### ISSUE TITLE
Stop unnecessary reverse lookup of incoming SSH connections

### ISSUE THREAD

**Issue by markusboehme** [bottlerocket-os/bottlerocket-admin-container#84]
**Image I'm using:** Any Bottlerocket image with the latest admin container v0.10.2

**Issue or Feature Request:** When logging into the admin container via SSH, a multitude of DNS requests are sent. Here's a subset of them observed via `tcpdump 'port 53'` inside the admin container in a local virtualized environment (10.0.2.15 is the virtual interface, 10.0.2.2 the virtual gateway, 10.0.2.3 QEMU's virtual resolver):

```
20:43:19.268506 IP ip-10-0-2-15.eu-central-1.compute.internal.60800 > ip-10-0-2-3.eu-central-1.compute.internal.domain: 49101+ PTR? 2.2.0.10.in-addr.arpa. (39)
20:43:19.270473 IP ip-10-0-2-3.eu-central-1.compute.internal.domain > ip-10-0-2-15.eu-central-1.compute.internal.60800: 49101 1/0/0 PTR ip-10-0-2-2.eu-central-1.compute.internal. (94)
20:43:19.270691 IP ip-10-0-2-15.eu-central-1.compute.internal.42991 > ip-10-0-2-3.eu-central-1.compute.internal.domain: 16137+ A? ip-10-0-2-2.eu-central-1.compute.internal. (59)
20:43:19.271989 IP ip-10-0-2-3.eu-central-1.compute.internal.domain > ip-10-0-2-15.eu-central-1.compute.internal.42991: 16137 1/0/0 A 10.0.2.2 (75)
20:43:19.291881 IP ip-10-0-2-15.eu-central-1.compute.internal.45672 > ip-10-0-2-3.eu-central-1.compute.internal.domain: 45883+ A? ip-10-0-2-2.eu-central-1.compute.internal. (59)
20:43:19.291930 IP ip-10-0-2-15.eu-central-1.compute.internal.45672 > ip-10-0-2-3.eu-central-1.compute.internal.domain: 33852+ AAAA? ip-10-0-2-2.eu-central-1.compute.internal. (59)
20:43:19.293347 IP ip-10-0-2-3.eu-central-1.compute.internal.domain > ip-10-0-2-15.eu-central-1.compute.internal.45672: 45883 1/0/0 A 10.0.2.2 (75)
20:43:19.293820 IP ip-10-0-2-3.eu-central-1.compute.internal.domain > ip-10-0-2-15.eu-central-1.compute.internal.45672: 33852 0/1/0 (120)
[...]
```

These come down to `UseDNS yes` implicitly being set in the sshd configuration. However, the admin container does not configure sshd in any way to actually make use of the looked up host name (e.g. `Match Host`). I'd like us to set `UseDNS no` to stop the unnecessary reverse lookups.

**Comment by markusboehme** [comment]
PR #85 was merged and released in v0.11.0.
